[
  {
    "heroId": "airi",
    "roleId_1": "warrior",
    "roleId_2": "assassin",
    "laneId_1": "slayer",
    "name": "Airi",
    "assetAvatar": "heroes/avatars/Airi.webp",
    "assetSplash": "heroes/splashes/Airi.webp"
  },
  {
    "heroId": "aleister",
    "roleId_1": "mage",
    "roleId_2": "support",
    "laneId_1": "mid",
    "laneId_2": "roam",
    "name": "Aleister",
    "assetAvatar": "heroes/avatars/Aleister.webp",
    "assetSplash": "heroes/splashes/Aleister.webp"
  },
  {
    "heroId": "alice",
    "roleId_1": "support",
    "laneId_1": "roam",
    "name": "Alice",
    "assetAvatar": "heroes/avatars/Alice.webp",
    "assetSplash": "heroes/splashes/Alice.webp"
  },
  {
    "heroId": "allain",
    "roleId_1": "warrior",
    "laneId_1": "slayer",
    "name": "Allain",
    "assetAvatar": "heroes/avatars/Allain.webp",
    "assetSplash": "heroes/splashes/Allain.webp"
  },
  {
    "heroId": "amily",
    "roleId_1": "warrior",
    "laneId_1": "slayer",
    "laneId_2": "jungle",
    "name": "Amily",
    "assetAvatar": "heroes/avatars/Amily.webp",
    "assetSplash": "heroes/splashes/Amily.webp"
  },
  {
    "heroId": "annette",
    "roleId_1": "mage",
    "roleId_2": "support",
    "laneId_1": "roam",
    "laneId_2": "mid",
    "name": "Annette",
    "assetAvatar": "heroes/avatars/Annette.webp",
    "assetSplash": "heroes/splashes/Annette.webp"
  },
  {
    "heroId": "aoi",
    "roleId_1": "assassin",
    "laneId_1": "jungle",
    "name": "Aoi",
    "assetAvatar": "heroes/avatars/Aoi.webp",
    "assetSplash": "heroes/splashes/Aoi.webp"
  },
  {
    "heroId": "arduin",
    "roleId_1": "tank",
    "laneId_1": "roam",
    "laneId_2": "slayer",
    "name": "Arduin",
    "assetAvatar": "heroes/avatars/Arduin.webp",
    "assetSplash": "heroes/splashes/Arduin.webp"
  },
  {
    "heroId": "arthur",
    "roleId_1": "warrior",
    "laneId_1": "slayer",
    "laneId_2": "roam",
    "name": "Arthur",
    "assetAvatar": "heroes/avatars/Arthur.webp",
    "assetSplash": "heroes/splashes/Arthur.webp"
  },
  {
    "heroId": "arum",
    "roleId_1": "support",
    "laneId_1": "roam",
    "name": "Arum",
    "assetAvatar": "heroes/avatars/Arum.webp",
    "assetSplash": "heroes/splashes/Arum.webp"
  },
  {
    "heroId": "astrid",
    "roleId_1": "warrior",
    "laneId_1": "slayer",
    "laneId_2": "jungle",
    "name": "Astrid",
    "assetAvatar": "heroes/avatars/Astrid.webp",
    "assetSplash": "heroes/splashes/Astrid.webp"
  },
  {
    "heroId": "ata",
    "roleId_1": "warrior",
    "roleId_2": "tank",
    "laneId_1": "slayer",
    "laneId_2": "roam",
    "name": "Ata",
    "assetAvatar": "heroes/avatars/Ata.webp",
    "assetSplash": "heroes/splashes/Ata.webp"
  },
  {
    "heroId": "aya",
    "roleId_1": "support",
    "laneId_1": "roam",
    "laneId_2": "mid",
    "name": "Aya",
    "assetAvatar": "heroes/avatars/Aya.webp",
    "assetSplash": "heroes/splashes/Aya.webp"
  },
  {
    "heroId": "azzenka",
    "roleId_1": "mage",
    "laneId_1": "mid",
    "name": "Azzen'ka",
    "assetAvatar": "heroes/avatars/Azzenka.webp",
    "assetSplash": "heroes/splashes/Azzenka.webp"
  },
  {
    "heroId": "baldum",
    "roleId_1": "tank",
    "laneId_1": "roam",
    "name": "Baldum",
    "assetAvatar": "heroes/avatars/Baldum.webp",
    "assetSplash": "heroes/splashes/Baldum.webp"
  },
  {
    "heroId": "bijan",
    "roleId_1": "warrior",
    "laneId_1": "slayer",
    "name": "Bijan",
    "assetAvatar": "heroes/avatars/Bijan.webp",
    "assetSplash": "heroes/splashes/Bijan.webp"
  },
  {
    "heroId": "billow",
    "roleId_1": "warrior",
    "roleId_2": "assassin",
    "laneId_1": "jungle",
    "laneId_2": "slayer",
    "name": "Billow",
    "assetAvatar": "heroes/avatars/Billow.webp",
    "assetSplash": "heroes/splashes/Billow.webp"
  },
  {
    "heroId": "biron",
    "roleId_1": "warrior",
    "roleId_2": "tank",
    "laneId_1": "slayer",
    "name": "Biron",
    "assetAvatar": "heroes/avatars/Biron.webp",
    "assetSplash": "heroes/splashes/Biron.webp"
  },
  {
    "heroId": "bolt_baron",
    "roleId_1": "warrior",
    "roleId_2": "mage",
    "laneId_1": "slayer",
    "laneId_2": "jungle",
    "name": "Bolt Baron",
    "assetAvatar": "heroes/avatars/Bolt_Baron.webp",
    "assetSplash": "heroes/splashes/Bolt_Baron.webp"
  },
  {
    "heroId": "bonnie",
    "roleId_1": "mage",
    "laneId_1": "mid",
    "laneId_2": "roam",
    "name": "Bonnie",
    "assetAvatar": "heroes/avatars/Bonnie.webp",
    "assetSplash": "heroes/splashes/Bonnie.webp"
  },
  {
    "heroId": "bright",
    "roleId_1": "assassin",
    "roleId_2": "marksman",
    "laneId_1": "jungle",
    "laneId_2": "dragon",
    "laneId_3": "slayer",
    "name": "Bright",
    "assetAvatar": "heroes/avatars/Bright.webp",
    "assetSplash": "heroes/splashes/Bright.webp"
  },
  {
    "heroId": "butterfly",
    "roleId_1": "warrior",
    "roleId_2": "assassin",
    "laneId_1": "jungle",
    "name": "Butterfly",
    "assetAvatar": "heroes/avatars/Butterfly.webp",
    "assetSplash": "heroes/splashes/Butterfly.webp"
  },
  {
    "heroId": "capheny",
    "roleId_1": "marksman",
    "laneId_1": "dragon",
    "name": "Capheny",
    "assetAvatar": "heroes/avatars/Capheny.webp",
    "assetSplash": "heroes/splashes/Capheny.webp"
  },
  {
    "heroId": "celica",
    "roleId_1": "marksman",
    "laneId_1": "dragon",
    "name": "Celica",
    "assetAvatar": "heroes/avatars/Celica.webp",
    "assetSplash": "heroes/splashes/Celica.webp"
  },
  {
    "heroId": "charlotte",
    "roleId_1": "warrior",
    "laneId_1": "slayer",
    "name": "Charlotte",
    "assetAvatar": "heroes/avatars/Charlotte.webp",
    "assetSplash": "heroes/splashes/Charlotte.webp"
  },
  {
    "heroId": "chaugnar",
    "roleId_1": "tank",
    "roleId_2": "support",
    "laneId_1": "roam",
    "name": "Chaugnar",
    "assetAvatar": "heroes/avatars/Chaugnar.webp",
    "assetSplash": "heroes/splashes/Chaugnar.webp"
  },
  {
    "heroId": "cresht",
    "roleId_1": "tank",
    "roleId_2": "support",
    "laneId_1": "roam",
    "name": "Cresht",
    "assetAvatar": "heroes/avatars/Cresht.webp",
    "assetSplash": "heroes/splashes/Cresht.webp"
  },
  {
    "heroId": "darcy",
    "roleId_1": "mage",
    "laneId_1": "mid",
    "laneId_2": "jungle",
    "name": "D'arcy",
    "assetAvatar": "heroes/avatars/Darcy.webp",
    "assetSplash": "heroes/splashes/Darcy.webp"
  },
  {
    "heroId": "dextra",
    "roleId_1": "warrior",
    "roleId_2": "tank",
    "laneId_1": "slayer",
    "name": "Dextra",
    "assetAvatar": "heroes/avatars/Dextra.webp",
    "assetSplash": "heroes/splashes/Dextra.webp"
  },
  {
    "heroId": "diaochan",
    "roleId_1": "mage",
    "laneId_1": "mid",
    "laneId_2": "roam",
    "name": "Điêu Thuyền",
    "assetAvatar": "heroes/avatars/Diaochan.webp",
    "assetSplash": "heroes/splashes/Diaochan.webp"
  },
  {
    "heroId": "dirak",
    "roleId_1": "mage",
    "laneId_1": "mid",
    "name": "Dirak",
    "assetAvatar": "heroes/avatars/Dirak.webp",
    "assetSplash": "heroes/splashes/Dirak.webp"
  },
  {
    "heroId": "dolia",
    "roleId_1": "support",
    "laneId_1": "roam",
    "laneId_2": "mid",
    "name": "Dolia",
    "assetAvatar": "heroes/avatars/Dolia.webp",
    "assetSplash": "heroes/splashes/Dolia.webp"
  },
  {
    "heroId": "dyadia",
    "roleId_1": "mage",
    "roleId_2": "support",
    "laneId_1": "roam",
    "name": "Dyadia",
    "assetAvatar": "heroes/avatars/Dyadia.webp",
    "assetSplash": "heroes/splashes/Dyadia.webp"
  },
  {
    "heroId": "edras",
    "roleId_1": "warrior",
    "laneId_1": "slayer",
    "laneId_2": "jungle",
    "name": "Edras",
    "assetAvatar": "heroes/avatars/Edras.webp",
    "assetSplash": "heroes/splashes/Edras.webp"
  },
  {
    "heroId": "elandorr",
    "roleId_1": "marksman",
    "laneId_1": "jungle",
    "laneId_2": "dragon",
    "name": "Eland'orr",
    "assetAvatar": "heroes/avatars/Elandorr.webp",
    "assetSplash": "heroes/splashes/Elandorr.webp"
  },
  {
    "heroId": "elsu",
    "roleId_1": "marksman",
    "laneId_1": "dragon",
    "name": "Elsu",
    "assetAvatar": "heroes/avatars/Elsu.webp",
    "assetSplash": "heroes/splashes/Elsu.webp"
  },
  {
    "heroId": "enzo",
    "roleId_1": "assassin",
    "laneId_1": "roam",
    "laneId_2": "jungle",
    "name": "Enzo",
    "assetAvatar": "heroes/avatars/Enzo.webp",
    "assetSplash": "heroes/splashes/Enzo.webp"
  },
  {
    "heroId": "erin",
    "roleId_1": "mage",
    "roleId_2": "marksman",
    "laneId_1": "dragon",
    "laneId_2": "mid",
    "name": "Erin",
    "assetAvatar": "heroes/avatars/Erin.webp",
    "assetSplash": "heroes/splashes/Erin.webp"
  },
  {
    "heroId": "errol",
    "roleId_1": "warrior",
    "laneId_1": "jungle",
    "laneId_2": "slayer",
    "name": "Errol",
    "assetAvatar": "heroes/avatars/Errol.webp",
    "assetSplash": "heroes/splashes/Errol.webp"
  },
  {
    "heroId": "evita",
    "roleId_1": "mage",
    "laneId_1": "mid",
    "name": "Evita",
    "assetAvatar": "heroes/avatars/Evita.webp",
    "assetSplash": "heroes/splashes/Evita.webp"
  },
  {
    "heroId": "fennik",
    "roleId_1": "marksman",
    "laneId_1": "dragon",
    "laneId_2": "jungle",
    "name": "Fennik",
    "assetAvatar": "heroes/avatars/Fennik.webp",
    "assetSplash": "heroes/splashes/Fennik.webp"
  },
  {
    "heroId": "florentino",
    "roleId_1": "warrior",
    "laneId_1": "slayer",
    "name": "Florentino",
    "assetAvatar": "heroes/avatars/Florentino.webp",
    "assetSplash": "heroes/splashes/Florentino.webp"
  },
  {
    "heroId": "flowborn_f_mage",
    "roleId_1": "mage",
    "laneId_1": "mid",
    "name": "Flowborn (Pháp Sư)",
    "assetAvatar": "heroes/avatars/Flowborn_F_Mage.webp",
    "assetSplash": "heroes/splashes/Flowborn_F_Mage.webp"
  },
  {
    "heroId": "flowborn_f_marksman",
    "roleId_1": "marksman",
    "laneId_1": "dragon",
    "name": "Flowborn (Xạ Thủ)",
    "assetAvatar": "heroes/avatars/Flowborn_F_Marksman.webp",
    "assetSplash": "heroes/splashes/Flowborn_F_Marksman.webp"
  },
  {